### ISSUE TITLE
手机视频app打开后，有大量的dns查询，直接占满cat /proc/v2ray pid/limits的上限，导致正常的dns查询无法进行而出现网络问题

### ISSUE THREAD

**Issue by dukong** [v2ray/discussion#654]
使用的是Tproxy透明代理教程https://toutyrater.github.io/app/tproxy.html
v2ray所在的OS是centos7，ip192.168.99.2，已关闭防火墙、禁用selinux。
局域网内的电脑和手机能正常使用dns分流，实现国外ip走代理。
但是手机上的视频app（比如腾讯视频、bilibili等）打开的时候，在192.168.99.2上，ls /proc/v2ray pid/fd -l | wc -l激增到cat /proc/v2ray pid/limits的上限（默认1024），大部分的视频缩图会无法显示，要等ls /proc/v2ray pid/fd -l | wc -l数值下来后缩图才能出来。滑动app页面后，后面的又无法显示，ls /proc/v2ray pid/fd -l | wc -l又达到上限，等降下来后，又能正常显示了。异常的时候，其他机子的各种网络应用也出现卡住的问题。netstat -ntup显示有大量的连接本机53端口的dns查询。前面说的各种异常，应该是dns无法查询导致的，猜测是因为v2ray暂时被os限制住了而无法进行dns查询操作。
折腾了几天，也翻遍了issues，没找到方法。
尝试了v2ray的4.22.1和4.23.1两个版本。

------------config.json--------------
```javascript
 {
	"log": {
		"access": "/tmp/v2ray_access.log",
		"error": "/tmp/v2ray_error.log",
		"loglevel": "warning"
	},
	"inbounds": [
		{
			"tag": "transparent",
			"port": 12345,
			"protocol": "dokodemo-door",
			"settings": {
				"network": "tcp,udp",
				"followRedirect": true
			},
			"sniffing": {
				"enabled": true,
				"destOverride": [
					"http",
					"tls"
				]
			},
			"streamSettings": {
				"sockopt": {
					"tproxy": "tproxy"// 透明代理使用 TPROXY 方式
				}
			}
		},
		{
			"tag": "socks",
			"port": 1080, 
			"protocol": "socks", // 入口协议为 SOCKS 5
			"sniffing": {
			"enabled": true,
			"destOverride": ["http", "tls"]
			},
			"settings": {
			"auth": "noauth"
			}
		}
	],
	"outbounds": [
		{	"tag": "proxy",
			"protocol": "vmess",
			"sendThrough": "0.0.0.0",
			"settings": {
				"vnext": [
					{
						"address": "xxx.com",
						"port": 443,
						"users": [
							{
								"alterId": 0,
								"id": "xxx",
								"level": 0,
								"security": "auto"
							}
						]
					}
				]
			},
			"streamSettings": {
				"network": "ws",
				"security": "tls",
				"wsSettings": {
					"headers": {},
					"path": "/chat"
				},
				"tlsSettings": {
					"allowInsecure": true	//接受自签名证书或者过期的证书
				},
				"sockopt": {
					"mark": 255	//和iptables的那个0xff对应
				}
			}
		},
		{
			"tag": "direct",
			"protocol": "freedom",
			"settings": {
				"domainStrategy": "UseIP"
			},
			"streamSettings": {
				"sockopt": {
					"mark": 255	//和iptables的那个0xff对应
				}
			}
		},
		{
			"tag": "block",
			"protocol": "blackhole",
			"settings": {
				"response": {
					"type": "http"
				}
			}
		},
		{
			"tag": "dns-out",
			"protocol": "dns",
			"streamSettings": {
				"sockopt": {
					"mark": 255		//和iptables的那个0xff对应
				}
			}
		}
	],
	"dns": {
		"servers": [
			{
				"address": "202.96.209.133",
				"port": 53,
				"domains": [
					"geosite:cn",
					"ntp.org",
					"domain:xxx.com"
				]
			},
			"8.8.8.8",
			"1.1.1.1",
			"223.5.5.5"		]
	},
	"routing": {
		"domainStrategy": "IPOnDemand",
		"rules": [
			{//dns流量
				"type": "field",
				"inboundTag": [
					"transparent"
				],
				"port": 53,
				"network": "udp",
				"outboundTag": "dns-out"
			},
			{// 直连 123 端口 UDP 流量（NTP 协议）
				"type": "field",
				"inboundTag": [
					"transparent"
				],
				"port": 123,
				"network": "udp",
				"outboundTag": "direct"
			},
			{//国内dns服务器
				"type": "field",
				"ip": [
					"202.96.209.133",	//上海电信
					"223.5.5.5",	//阿里云
					"114.114.114.114"
				],
				"outboundTag": "direct"
			},
			{//国外dns服务器
				"type": "field",
				"ip": [
					"8.8.8.8",	//谷歌DNS
					"1.1.1.1"	//Cloudflare DNS
				],
				"outboundTag": "proxy"
			},
			{
				"type": "field",
				"protocol": [
					"bittorrent"
				],
				"outboundTag": "direct"
			},
			{
				"type": "field",
				"ip": [
					"geoip:private",	//私有IP地址
					"geoip:cn"		//国内IP
				],
				"outboundTag": "direct"
			},
			{
				"type": "field",
				"domain": [//国内域名
					"geosite:cn",
					"domain:qq.com", //解决微信语音无法接受（或者被对方接受）的问题。
					"domain:wechat.com"
					//"domain:bilibili.com"
				],
				"outboundTag": "direct"
			}
		]
	}
}
```
----------------------
```javascript
[root@tproxy ~]# cat /proc/3385/limits
Limit                     Soft Limit           Hard Limit           Units
Max cpu time              unlimited            unlimited            seconds
Max file size             unlimited            unlimited            bytes
Max data size             unlimited            unlimited            bytes
Max stack size            8388608              unlimited            bytes
Max core file size        0                    unlimited            bytes
Max resident set          unlimited            unlimited            bytes
Max processes             1781                 1781                 processes
Max open files            1024                 4096                 files
Max locked memory         65536                65536                bytes
Max address space         unlimited            unlimited            bytes
Max file locks            unlimited            unlimited            locks
Max pending signals       1781                 1781                 signals
Max msgqueue size         819200               819200               bytes
Max nice priority         0                    0
Max realtime priority     0                    0
Max realtime timeout      unlimited            unlimited            us



[root@tproxy ~]# ls /proc/3385/fd -l | wc -l
1024
```

----------------部分netstat--------------
```javascript
udp        0      0 192.168.99.2:53         192.168.99.2:49996      ESTABLISHED 3385/v2ray
udp        0      0 192.168.99.2:53         192.168.99.2:35121      ESTABLISHED 3385/v2ray
udp        0      0 192.168.99.2:53         192.168.99.2:50605      ESTABLISHED 3385/v2ray
udp        0      0 192.168.99.2:53         192.168.99.2:47269      ESTABLISHED 3385/v2ray
udp        0      0 192.168.99.2:53         192.168.99.2:58774      ESTABLISHED 3385/v2ray
udp        0      0 192.168.99.2:53         192.168.99.2:55981      ESTABLISHED 3385/v2ray
udp        0      0 192.168.99.2:53         192.168.99.2:33157      ESTABLISHED 3385/v2ray
udp        0      0 192.168.99.2:53         192.168.99.2:35345      ESTABLISHED 3385/v2ray
udp        0      0 192.168.99.2:53         192.168.99.2:46327      ESTABLISHED 3385/v2ray
udp        0      0 192.168.99.2:53         192.168.99.2:52262      ESTABLISHED 3385/v2ray
udp        0      0 192.168.99.2:53         192.168.99.2:56134      ESTABLISHED 3385/v2ray
udp        0      0 192.168.99.2:53         192.168.99.2:58773      ESTABLISHED 3385/v2ray
udp        0      0 192.168.99.2:53         192.168.99.2:54192      ESTABLISHED 3385/v2ray
udp        0      0 192.168.99.2:53         192.168.99.2:59868      ESTABLISHED 3385/v2ray
udp        0      0 192.168.99.2:53         192.168.99.2:48267      ESTABLISHED 3385/v2ray
udp        0      0 192.168.99.2:53         192.168.99.2:59504      ESTABLISHED 3385/v2ray
udp        0      0 192.168.99.2:53         192.168.99.2:60448      ESTABLISHED 3385/v2ray
udp        0      0 192.168.99.2:53         192.168.99.2:49653      ESTABLISHED 3385/v2ray
udp        0      0 192.168.99.2:53         192.168.99.2:60750      ESTABLISHED 3385/v2ray
udp        0      0 192.168.99.2:53         192.168.99.2:40545      ESTABLISHED 3385/v2ray
udp        0      0 192.168.99.2:53         192.168.99.2:39287      ESTABLISHED 3385/v2ray
udp        0      0 192.168.99.2:53         192.168.99.2:37152      ESTABLISHED 3385/v2ray
udp        0      0 192.168.99.2:53         192.168.99.2:48285      ESTABLISHED 3385/v2ray
udp        0      0 192.168.99.2:53         192.168.99.2:55776      ESTABLISHED 3385/v2ray
udp        0      0 192.168.99.2:53         192.168.99.2:35276      ESTABLISHED 3385/v2ray
udp        0      0 192.168.99.2:53         192.168.99.2:60925      ESTABLISHED 3385/v2ray
udp        0      0 192.168.99.2:53         192.168.99.2:50875      ESTABLISHED 3385/v2ray
udp        0      0 192.168.99.2:53         192.168.99.2:35023      ESTABLISHED 3385/v2ray
udp        0      0 192.168.99.2:53         192.168.99.2:34752      ESTABLISHED 3385/v2ray
udp        0      0 192.168.99.2:53         192.168.99.2:48699      ESTABLISHED 3385/v2ray
udp        0      0 192.168.99.2:53         192.168.99.2:51028      ESTABLISHED 3385/v2ray
udp        0      0 192.168.99.2:53         192.168.99.2:40744      ESTABLISHED 3385/v2ray
udp        0      0 192.168.99.2:53         192.168.99.2:34238      ESTABLISHED 3385/v2ray
udp        0      0 192.168.99.2:53         192.168.99.2:59276      ESTABLISHED 3385/v2ray
udp        0      0 192.168.99.2:53         192.168.99.2:52287      ESTABLISHED 3385/v2ray
udp        0      0 192.168.99.2:53         192.168.99.2:52269      ESTABLISHED 3385/v2ray
udp        0      0 192.168.99.2:53         192.168.99.2:56217      ESTABLISHED 3385/v2ray
udp        0      0 192.168.99.2:53         192.168.99.2:39549      ESTABLISHED 3385/v2ray
udp        0      0 192.168.99.2:53         192.168.99.2:57763      ESTABLISHED 3385/v2ray
udp        0      0 192.168.99.2:53         192.168.99.2:34780      ESTABLISHED 3385/v2ray
udp        0      0 192.168.99.2:53         192.168.99.2:47087      ESTABLISHED 3385/v2ray
udp        0      0 192.168.99.2:53         192.168.99.2:42750      ESTABLISHED 3385/v2ray
udp        0      0 192.168.99.2:53         192.168.99.2:60069      ESTABLISHED 3385/v2ray
udp        0      0 192.168.99.2:53         192.168.99.242:59751    ESTABLISHED 3385/v2ray
udp        0      0 192.168.99.2:53         192.168.99.242:58648    ESTABLISHED 3385/v2ray
udp        0      0 192.168.99.2:53         192.168.99.242:65291    ESTABLISHED 3385/v2ray
udp        0      0 192.168.99.2:53         192.168.99.242:61445    ESTABLISHED 3385/v2ray
udp        0      0 192.168.99.2:53         192.168.99.242:45344    ESTABLISHED 3385/v2ray
udp        0      0 192.168.99.2:53         192.168.99.242:37529    ESTABLISHED 3385/v2ray
udp        0      0 192.168.99.2:53         192.168.99.242:47442    ESTABLISHED 3385/v2ray
udp        0      0 192.168.99.2:53         192.168.99.242:60178    ESTABLISHED 3385/v2ray
udp        0      0 192.168.99.2:53         192.168.99.242:37278    ESTABLISHED 3385/v2ray
udp        0      0 192.168.99.2:53         192.168.99.242:38888    ESTABLISHED 3385/v2ray
udp        0      0 192.168.99.2:53         192.168.99.242:52122    ESTABLISHED 3385/v2ray
udp        0      0 192.168.99.2:53         192.168.99.242:46342    ESTABLISHED 3385/v2ray
udp        0      0 192.168.99.2:53         192.168.99.242:53272    ESTABLISHED 3385/v2ray
udp        0      0 192.168.99.2:53         192.168.99.242:45025    ESTABLISHED 3385/v2ray
udp        0      0 192.168.99.2:53         192.168.99.242:61055    ESTABLISHED 3385/v2ray
udp        0      0 192.168.99.2:53         192.168.99.242:59791    ESTABLISHED 3385/v2ray
udp        0      0 192.168.99.2:53         192.168.99.242:47482    ESTABLISHED 3385/v2ray
udp        0      0 192.168.99.2:53         192.168.99.242:34896    ESTABLISHED 3385/v2ray
udp        0      0 192.168.99.2:53         192.168.99.242:41146    ESTABLISHED 3385/v2ray
udp        0      0 192.168.99.2:53         192.168.99.242:57088    ESTABLISHED 3385/v2ray
udp        0      0 192.168.99.2:53         192.168.99.242:35845    ESTABLISHED 3385/v2ray
udp        0      0 192.168.99.2:53         192.168.99.242:42608    ESTABLISHED 3385/v2ray
udp        0      0 192.168.99.2:53         192.168.99.242:63077    ESTABLISHED 3385/v2ray
udp        0      0 192.168.99.2:53         192.168.99.242:51357    ESTABLISHED 3385/v2ray
udp        0      0 192.168.99.2:53         192.168.99.242:42376    ESTABLISHED 3385/v2ray
udp        0      0 172.19.16.245:161       192.168.99.223:60351    ESTABLISHED 3385/v2ray
```

---------------部分log------------------
```javascript
2020/04/19 16:39:08 [Debug] [3051061238] v2ray.com/core/proxy/dokodemo: processing connection from: 192.168.99.2:37439
2020/04/19 16:39:08 [Info] [3051061238] v2ray.com/core/app/dispatcher: taking detour [dns-out] for [udp:192.168.99.2:53]
2020/04/19 16:39:08 [Info] [3051061238] v2ray.com/core/proxy/dns: handling DNS traffic to udp:192.168.99.2:53
2020/04/19 16:39:08 [Debug] v2ray.com/core/transport/internet/udp: UDP original destination: udp:192.168.99.2:53
2020/04/19 16:39:08 [Debug] [3223377712] v2ray.com/core/proxy/dokodemo: processing connection from: 192.168.99.2:54991
2020/04/19 16:39:08 [Info] [3223377712] v2ray.com/core/app/dispatcher: taking detour [dns-out] for [udp:192.168.99.2:53]
2020/04/19 16:39:08 [Info] [3223377712] v2ray.com/core/proxy/dns: handling DNS traffic to udp:192.168.99.2:53
2020/04/19 16:39:08 [Debug] v2ray.com/core/transport/internet/udp: UDP original destination: udp:192.168.99.2:53
2020/04/19 16:39:08 [Debug] [1268802051] v2ray.com/core/proxy/dokodemo: processing connection from: 192.168.99.2:45681
2020/04/19 16:39:08 [Info] [1268802051] v2ray.com/core/app/dispatcher: taking detour [dns-out] for [udp:192.168.99.2:53]
2020/04/19 16:39:08 [Info] [1268802051] v2ray.com/core/proxy/dns: handling DNS traffic to udp:192.168.99.2:53
2020/04/19 16:39:08 [Debug] v2ray.com/core/transport/internet/udp: UDP original destination: udp:192.168.99.2:53
2020/04/19 16:39:08 [Debug] [3254023852] v2ray.com/core/proxy/dokodemo: processing connection from: 192.168.99.2:59443
2020/04/19 16:39:08 [Info] [3254023852] v2ray.com/core/app/dispatcher: taking detour [dns-out] for [udp:192.168.99.2:53]
2020/04/19 16:39:08 [Info] [3254023852] v2ray.com/core/proxy/dns: handling DNS traffic to udp:192.168.99.2:53
2020/04/19 16:39:08 [Debug] v2ray.com/core/transport/internet/udp: UDP original destination: udp:192.168.99.2:53
2020/04/19 16:39:08 [Debug] [186220551] v2ray.com/core/proxy/dokodemo: processing connection from: 192.168.99.2:39036
2020/04/19 16:39:08 [Info] [186220551] v2ray.com/core/app/dispatcher: taking detour [dns-out] for [udp:192.168.99.2:53]
2020/04/19 16:39:08 [Info] [186220551] v2ray.com/core/proxy/dns: handling DNS traffic to udp:192.168.99.2:53
2020/04/19 16:39:08 [Debug] v2ray.com/core/transport/internet/udp: UDP original destination: udp:192.168.99.2:53
2020/04/19 16:39:08 [Debug] [1973745721] v2ray.com/core/proxy/dokodemo: processing connection from: 192.168.99.2:50330
2020/04/19 16:39:08 [Info] [1973745721] v2ray.com/core/app/dispatcher: taking detour [dns-out] for [udp:192.168.99.2:53]
2020/04/19 16:39:08 [Info] [1973745721] v2ray.com/core/proxy/dns: handling DNS traffic to udp:192.168.99.2:53
2020/04/19 16:39:08 [Debug] v2ray.com/core/transport/internet/udp: UDP original destination: udp:192.168.99.2:53
2020/04/19 16:39:08 [Debug] [1848735475] v2ray.com/core/proxy/dokodemo: processing connection from: 192.168.99.2:43942
2020/04/19 16:39:08 [Info] [1848735475] v2ray.com/core/app/dispatcher: taking detour [dns-out] for [udp:192.168.99.2:53]
2020/04/19 16:39:08 [Info] [1848735475] v2ray.com/core/proxy/dns: handling DNS traffic to udp:192.168.99.2:53
2020/04/19 16:39:08 [Debug] v2ray.com/core/transport/internet/udp: UDP original destination: udp:192.168.99.2:53
2020/04/19 16:39:08 [Debug] [777818642] v2ray.com/core/proxy/dokodemo: processing connection from: 192.168.99.2:60061
2020/04/19 16:39:08 [Info] [777818642] v2ray.com/core/app/dispatcher: taking detour [dns-out] for [udp:192.168.99.2:53]
2020/04/19 16:39:08 [Info] [777818642] v2ray.com/core/proxy/dns: handling DNS traffic to udp:192.168.99.2:53
2020/04/19 16:39:08 [Debug] v2ray.com/core/transport/internet/udp: UDP original destination: udp:192.168.99.2:53
2020/04/19 16:39:08 [Debug] [4259728215] v2ray.com/core/proxy/dokodemo: processing connection from: 192.168.99.2:46185
2020/04/19 16:39:08 [Info] [4259728215] v2ray.com/core/app/dispatcher: taking detour [dns-out] for [udp:192.168.99.2:53]
2020/04/19 16:39:08 [Info] [4259728215] v2ray.com/core/proxy/dns: handling DNS traffic to udp:192.168.99.2:53
2020/04/19 16:39:08 [Debug] v2ray.com/core/transport/internet/udp: UDP original destination: udp:192.168.99.2:53
2020/04/19 16:39:08 [Debug] [1669411998] v2ray.com/core/proxy/dokodemo: processing connection from: 192.168.99.2:46468
2020/04/19 16:39:08 [Info] [1669411998] v2ray.com/core/app/dispatcher: taking detour [dns-out] for [udp:192.168.99.2:53]
2020/04/19 16:39:08 [Info] [1669411998] v2ray.com/core/proxy/dns: handling DNS traffic to udp:192.168.99.2:53
2020/04/19 16:39:08 [Debug] v2ray.com/core/transport/internet/udp: UDP original destination: udp:192.168.99.2:53
2020/04/19 16:39:08 [Debug] [1820317089] v2ray.com/core/proxy/dokodemo: processing connection from: 192.168.99.2:53679
2020/04/19 16:39:08 [Info] [1820317089] v2ray.com/core/app/dispatcher: taking detour [dns-out] for [udp:192.168.99.2:53]
2020/04/19 16:39:08 [Info] [1820317089] v2ray.com/core/proxy/dns: handling DNS traffic to udp:192.168.99.2:53
2020/04/19 16:39:08 [Debug] v2ray.com/core/transport/internet/udp: UDP original destination: udp:192.168.99.2:53
```
还有这些log，淹没在上面的log中，（上面和下面是不同时间复制的，所以时间不准）
```javascript
2020/04/21 19:05:38 [Warning] v2ray.com/core/proxy/dns: failed to dial outbound connection > listen udp 0.0.0.0:0: socket: too many open files
2020/04/21 19:05:41 [Warning] v2ray.com/core/transport/internet/tcp: failed to accepted raw connections > accept tcp [::]:12345: accept4: too many open files
2020/04/21 19:05:42 [Warning] v2ray.com/core/transport/internet/tcp: failed to accepted raw connections > accept tcp [::]:12345: accept4: too many open files
2020/04/21 19:05:42 [Warning] v2ray.com/core/transport/internet/tcp: failed to accepted raw connections > accept tcp [::]:12345: accept4: too many open files
2020/04/21 19:05:43 [Warning] v2ray.com/core/transport/internet/tcp: failed to accepted raw connections > accept tcp [::]:12345: accept4: too many open files
2020/04/21 19:05:43 [Warning] v2ray.com/core/transport/internet/tcp: failed to accepted raw connections > accept tcp [::]:12345: accept4: too many open files
2020/04/21 19:05:44 [Warning] v2ray.com/core/transport/internet/tcp: failed to accepted raw connections > accept tcp [::]:12345: accept4: too many open files
2020/04/21 19:05:44 [Warning] v2ray.com/core/proxy/dns: failed to dial outbound connection > listen udp 0.0.0.0:0: socket: too many open files
2020/04/21 19:05:44 [Warning] v2ray.com/core/transport/internet/tcp: failed to accepted raw connections > accept tcp [::]:12345: accept4: too many open files
2020/04/21 19:05:45 [Warning] v2ray.com/core/transport/internet/tcp: failed to accepted raw connections > accept tcp [::]:12345: accept4: too many open files
2020/04/21 19:05:45 [Warning] v2ray.com/core/transport/internet/tcp: failed to accepted raw connections > accept tcp [::]:12345: accept4: too many open files
2020/04/21 19:05:46 [Warning] v2ray.com/core/transport/internet/tcp: failed to accepted raw connections > accept tcp [::]:12345: accept4: too many open files
2020/04/21 19:05:46 [Warning] v2ray.com/core/transport/internet/tcp: failed to accepted raw connections > accept tcp [::]:12345: accept4: too many open files
2020/04/21 19:06:02 [Warning] v2ray.com/core/proxy/dns: failed to dial outbound connection > listen udp 0.0.0.0:0: socket: too many open files
```

**Comment by dukong** [comment]
如果按照教程，修改 /etc/systemd/system/v2ray.service 文件，在 [Service] 下加入 LimitNPROC=500 和 LimitNOFILE=1000000，卡住的概率低一点，但是cpu占用异常的高，似乎没法从根本上解决问题。

**Comment by dukong** [comment]
[root@tproxy tmp]# iptables -t mangle -nxvL --line
Chain PREROUTING (policy ACCEPT 1279110 packets, 3172737785 bytes)
num      pkts      bytes target     prot opt in     out     source               destination
1    21461670 4768024424 V2RAY      all  --  *      *       0.0.0.0/0            0.0.0.0/0

Chain INPUT (policy ACCEPT 21460906 packets, 4767977774 bytes)
num      pkts      bytes target     prot opt in     out     source               destination

Chain FORWARD (policy ACCEPT 210 packets, 13160 bytes)
num      pkts      bytes target     prot opt in     out     source               destination

Chain OUTPUT (policy ACCEPT 21264819 packets, 4702233213 bytes)
num      pkts      bytes target     prot opt in     out     source               destination
1    21264819 4702233213 V2RAY_MASK  all  --  *      *       0.0.0.0/0            0.0.0.0/0

Chain POSTROUTING (policy ACCEPT 21265029 packets, 4702246373 bytes)
num      pkts      bytes target     prot opt in     out     source               destination

Chain V2RAY (1 references)
num      pkts      bytes target     prot opt in     out     source               destination
1           0        0 RETURN     all  --  *      *       0.0.0.0/0            127.0.0.1
2         254     8148 RETURN     all  --  *      *       0.0.0.0/0            224.0.0.0/4
3          19     6481 RETURN     all  --  *      *       0.0.0.0/0            255.255.255.255
4     1262210 3167524083 RETURN     tcp  --  *      *       0.0.0.0/0            192.168.0.0/16
5       16451  5144715 RETURN     udp  --  *      *       0.0.0.0/0            192.168.0.0/16       udp dpt:!53
6    19656240 1475393379 TPROXY     udp  --  *      *       0.0.0.0/0            0.0.0.0/0            TPROXY redirect 0.0.0.0:12345 mark 0x1/0xffffffff
7      526320 119893260 TPROXY     tcp  --  *      *       0.0.0.0/0            0.0.0.0/0            TPROXY redirect 0.0.0.0:12345 mark 0x1/0xffffffff

Chain V2RAY_MASK (1 references)
num      pkts      bytes target     prot opt in     out     source               destination
1           0        0 RETURN     all  --  *      *       0.0.0.0/0            224.0.0.0/4
2           0        0 RETURN     all  --  *      *       0.0.0.0/0            255.255.255.255
3      399028 3041806012 RETURN     tcp  --  *      *       0.0.0.0/0            192.168.0.0/16
4       12666  1537071 RETURN     udp  --  *      *       0.0.0.0/0            192.168.0.0/16       udp dpt:!53
5    20841004 1658280638 RETURN     all  --  *      *       0.0.0.0/0            0.0.0.0/0            mark match 0xff
6        5189   305485 MARK       udp  --  *      *       0.0.0.0/0            0.0.0.0/0            MARK set 0x1
7        6605   264200 MARK       tcp  --  *      *       0.0.0.0/0            0.0.0.0/0            MARK set 0x1

卡住的时候，V2RAY链的第4行和第6行，以及V2RAY_MASK链的第3行和第5行，数据表变化较大。

**Comment by okudayukiko** [comment]
我也遇到类似情况，加密换ChaCha20-Poly1305解决。

**Comment by dukong** [comment]
> 
> 
> 我也遇到類似情況，加密由AES-128-GCM換ChaCha20-Poly1305解決。
> [v2ray/v2ray-core#2445](https://github.com/v2ray/v2ray-core/issues/2445)

调整到"security": "chacha20-poly1305"配置，问题依旧。

自己感觉问题可能出在iptables的配置或者dns相关的配置上，导致了dns查询的接连触发，然后达到了v2ray在系统的cat /proc/<pid>/limits的中Max open files上限1024。

**Comment by okudayukiko** [comment]
TLS本來就有一層加密，您自己用OpenSSL看看就明白了。V2Ray的TLS預設使用TLS_AES_256_GCM_SHA384加密。
`openssl s_client host:443`

**Comment by dukong** [comment]
> 
> 
> TLS本來就有一層加密，您自己用OpenSSL看看就明白了。V2Ray的TLS預設使用TLS_AES_256_GCM_SHA384加密。
> `openssl s_client host:443`
已经根据你的建议，将加密方式改为chacha20-poly1305，但是现象还是和原来使用auto时的一摸一样。

**Comment by dukong** [comment]
> 
> 
> TLS本來就有一層加密，您自己用OpenSSL看看就明白了。V2Ray的TLS預設使用TLS_AES_256_GCM_SHA384加密。
> `openssl s_client host:443`

已经根据你的建议，将加密方式改为chacha20-poly1305，但是现象还是和原来使用auto时的一摸一样。

**Comment by okudayukiko** [comment]
> > TLS本來就有一層加密，您自己用OpenSSL看看就明白了。V2Ray的TLS預設使用TLS_AES_256_GCM_SHA384加密。
> > `openssl s_client host:443`
> 
> 已经根据你的建议，将加密方式改为chacha20-poly1305，但是现象还是和原来使用auto时的一摸一样。

一個是VMESS的加密，一個是TLS的加密。`"settings"`的`"security": "aes-128-gcm"`加密是VMESS協議的加密。`"streamsettings"`的`"security": "tls"`是啟用TLS的加密。V2Ray的TLS默認強制使用TLS_AES_256_GCM_SHA384。先將服務器和客戶端兩端的`"streamsettings"`設為`"security": "none"`

**Comment by dukong** [comment]
> 
> 
> > > TLS本來就有一層加密，您自己用OpenSSL看看就明白了。V2Ray的TLS預設使用TLS_AES_256_GCM_SHA384加密。
> > > `openssl s_client host:443`
> > 
> > 
> > 已经根据你的建议，将加密方式改为chacha20-poly1305，但是现象还是和原来使用auto时的一摸一样。
> 
> 一個是VMESS的加密，一個是TLS的加密。`"settings"`的`"security": "aes-128-gcm"`加密是VMESS協議的加密。`"streamsettings"`的`"security": "tls"`是啟用TLS的加密。V2Ray自帶的的TLS默認使用TLS_AES_256_GCM_SHA384。先將服務器和客戶端兩端的`"streamsettings"`設為`"security": "none"`。如果是V2Ray+Nginx，可以指定Nginx的SSL Cipher並關閉Nginx的TLSv1.3（Nginx的TLS1.3強制使用TLS_AES_256_GCM_SHA384，除非改`/etc/ssl/openssl.cnf`）。

机场是买的，没法改他们的配置，能改的只是我这边的客户端配置。：）
下面的改错地方了吗？
```javascript
{	"tag": "proxy",
			"protocol": "vmess",
			"sendThrough": "0.0.0.0",
			"settings": {
				"vnext": [
					{
						"address": "xxx.com",
						"port": 443,
						"users": [
							{
								"alterId": 0,
								"id": "xxx",
								"level": 0,
								"security": "chacha20-poly1305"
							}
						]
					}
				]
			},
			"streamSettings": {
				"network": "ws",
				"security": "tls",
				"wsSettings": {
					"headers": {},
					"path": "/chat"
				},
				"tlsSettings": {
					"allowInsecure": true	//接受自签名证书或者过期的证书
				},
				"sockopt": {
					"mark": 255	//和iptables的那个0xff对应
				}
			}
		},
```

**Comment by okudayukiko** [comment]
> > > > TLS本來就有一層加密，您自己用OpenSSL看看就明白了。V2Ray的TLS預設使用TLS_AES_256_GCM_SHA384加密。
> > > > `openssl s_client host:443`
> > > 
> > > 
> > > 已经根据你的建议，将加密方式改为chacha20-poly1305，但是现象还是和原来使用auto时的一摸一样。
> > 
> > 
> > 一個是VMESS的加密，一個是TLS的加密。`"settings"`的`"security": "aes-128-gcm"`加密是VMESS協議的加密。`"streamsettings"`的`"security": "tls"`是啟用TLS的加密。V2Ray自帶的的TLS默認使用TLS_AES_256_GCM_SHA384。先將服務器和客戶端兩端的`"streamsettings"`設為`"security": "none"`。如果是V2Ray+Nginx，可以指定Nginx的SSL Cipher並關閉Nginx的TLSv1.3（Nginx的TLS1.3強制使用TLS_AES_256_GCM_SHA384，除非改`/etc/ssl/openssl.cnf`）。
> 
> 机场是买的，没法改他们的配置，能改的只是我这边的客户端配置。：）
> 下面的改错地方了吗？
> 
> ```js
> {	"tag": "proxy",
> 			"protocol": "vmess",
> 			"sendThrough": "0.0.0.0",
> 			"settings": {
> 				"vnext": [
> 					{
> 						"address": "xxx.com",
> 						"port": 443,
> 						"users": [
> 							{
> 								"alterId": 0,
> 								"id": "xxx",
> 								"level": 0,
> 								"security": "chacha20-poly1305"
> 							}
> 						]
> 					}
> 				]
> 			},
> 			"streamSettings": {
> 				"network": "ws",
> 				"security": "tls",
> 				"wsSettings": {
> 					"headers": {},
> 					"path": "/chat"
> 				},
> 				"tlsSettings": {
> 					"allowInsecure": true	//接受自签名证书或者过期的证书
> 				},
> 				"sockopt": {
> 					"mark": 255	//和iptables的那个0xff对应
> 				}
> 			}
> 		},
> ```

買的機場就沒辦法。不過你可以自己買VPS試試。

**Comment by okudayukiko** [comment]
對，我也遇到這個問題，看YouTube等視頻卡頓。修改V2Ray服務端以下檔案解決：
`root@localhost:~# /etc/systemd/system.conf`
`DefaultLimitNOFILE=1000000`
`root@localhost:~# /etc/systemd/user.conf`
`DefaultLimitNOFILE=1000000`
難怪用V2Ray看視頻比Shadowsocks慢得多。

**Comment by dukong** [comment]
> 
> 
> 對，我也遇到這個問題，看YouTube等視頻卡頓。修改V2Ray服務端以下檔案解決：
> `root@localhost:~# /etc/systemd/system.conf`
> `DefaultLimitNOFILE=1000000`
> `root@localhost:~# /etc/systemd/user.conf`
> `DefaultLimitNOFILE=1000000`
> 其他VPN程式如Shadowsocks這麼修改後也快了很多。

嗯，这个方法教程中也提到了，但是似乎没有找到问题的根本，只能部分改善。
不太明白netstat -ntup显示有大量的连接本机53端口的dns查询，是否是正常现象。
如果是正常现象，那也就只能靠这个方法来改善了。
如果不是正常现象，那就要继续找方法。这也就是本贴的目的。

**Comment by dukong** [comment]
连续运行下面两个命令，结果如下：

[root@tproxy ~]# ls /proc/4983/fd -l | wc -l
1025
[root@tproxy ~]# ls /proc/4983/fd -l | wc -l
1024
[root@tproxy ~]# netstat -ntup |grep ":53 " | wc -l
476
[root@tproxy ~]# netstat -ntup |grep ":53 " | wc -l
476
[root@tproxy ~]# netstat -ntup |grep ":53 " | wc -l
476
[root@tproxy ~]# netstat -ntup |grep ":53 " | wc -l
476
[root@tproxy ~]# netstat -ntup |grep ":53 " | wc -l
476

**Comment by okudayukiko** [comment]
> > 對，我也遇到這個問題，看YouTube等視頻卡頓。修改V2Ray服務端以下檔案解決：
> > `root@localhost:~# /etc/systemd/system.conf`
> > `DefaultLimitNOFILE=1000000`
> > `root@localhost:~# /etc/systemd/user.conf`
> > `DefaultLimitNOFILE=1000000`
> > 其他VPN程式如Shadowsocks這麼修改後也快了很多。
> 
> 其实我这边看youtube不卡顿，网页打开bilibili等也正常，就是手机app打开不太正常。
> 你这个方法和教程中在服务中增加参数，原理类似，但是似乎没有找到问题的根本，只能部分改善。
> 不太明白netstat -ntup显示有大量的连接本机53端口的dns查询，是否是正常现象。
> 如果是正常现象，那也就只能靠这个方法来改善了。
> 如果不是正常现象，那就要继续找方法。这也就是本贴的目的。

為什麼V2Ray服務端必須用
`root@localhost:~# /etc/systemd/system.conf
DefaultLimitNOFILE=1000000`
`root@localhost:~# /etc/systemd/user.c`onf
DefaultLimitNOFILE=1000000`
不能用
`root@localhost:~# /etc/systemd/system.conf
DefaultLimitNOFILE=2000000`
`root@localhost:~# /etc/systemd/user.conf
DefaultLimitNOFILE=2000000`

**Comment by dukong** [comment]
不知道抓包会不会有什么线索？

**Comment by dukong** [comment]
基本已经确定是ptr查询导致的

```javascript
[root@tproxy ~]# tcpdump udp -nn -i ens32 port 53 | grep ".in-addr.arpa"
tcpdump: verbose output suppressed, use -v or -vv for full protocol decode
listening on ens32, link-type EN10MB (Ethernet), capture size 262144 bytes
19:06:57.235374 IP 192.168.99.220.39081 > 192.168.99.2.53: 51218+ PTR? 220.99.168.192.in-addr.arpa. (45)
19:07:02.258863 IP 192.168.99.220.39081 > 192.168.99.2.53: 51218+ PTR? 220.99.168.192.in-addr.arpa. (45)
19:07:07.265567 IP 192.168.99.220.41417 > 192.168.99.2.53: 51841+ PTR? 220.99.168.192.in-addr.arpa. (45)
19:07:08.407847 IP 192.168.99.220.44565 > 192.168.99.2.53: 44605+ PTR? 220.99.168.192.in-addr.arpa. (45)
19:07:12.260164 IP 192.168.99.220.41417 > 192.168.99.2.53: 51841+ PTR? 220.99.168.192.in-addr.arpa. (45)
19:07:13.424709 IP 192.168.99.220.44565 > 192.168.99.2.53: 44605+ PTR? 220.99.168.192.in-addr.arpa. (45)
19:07:19.624322 IP 192.168.99.220.37988 > 192.168.99.2.53: 33587+ PTR? 220.99.168.192.in-addr.arpa. (45)
19:07:54.227206 IP 192.168.99.220.55594 > 192.168.99.2.53: 37834+ PTR? 2.99.168.192.in-addr.arpa. (43)
19:07:59.779227 IP 192.168.99.220.55594 > 192.168.99.2.53: 37834+ PTR? 2.99.168.192.in-addr.arpa. (43)
19:08:15.752308 IP 192.168.99.242.63829 > 192.168.99.2.53: 56090+ PTR? 242.99.168.192.in-addr.arpa. (45)
19:08:20.754618 IP 192.168.99.242.63829 > 192.168.99.2.53: 56090+ PTR? 242.99.168.192.in-addr.arpa. (45)
19:08:25.760493 IP 192.168.99.242.44112 > 192.168.99.2.53: 39257+ PTR? 242.99.168.192.in-addr.arpa. (45)
19:08:26.806781 IP 192.168.99.242.47060 > 192.168.99.2.53: 40357+ PTR? 242.99.168.192.in-addr.arpa. (45)
..........
```

**Comment by dukong** [comment]
偶尔发现，修改一个ip配置就不会有这个问题了。
原来路由器（192.168.99.254）的dhcp分配给dhcp客户机的的网关和dns都是tproxy（192.168.99.2），只要将分配给dhcp客户机的dns改为192.168.99.254，就不会有这个问题了，似乎ptr查询也没有了，也不会有ls /proc/930/fd -l | wc -l达到上限的问题了。
