### ISSUE TITLE
HTTP Outbound的正确配置？

### ISSUE THREAD

**Issue by eN-Joy** [v2ray/discussion#729]
搏斗了几天http outbound的配置没有结果，想跟大神们澄清一下几个问题。我的应用场景特殊（不在国内，所以碰到的问题不同），在填写模板之前，我先提上来描述一下。

墙内的客户可以通过部分端口，以http方式访问我的外网服务器（下面代码中命名A），但是ISP的防火墙会干扰任何试图tls握手的连接，可能是RST方式（样本tcp包附后供参考）。所以vpn, shadowsocks, vmess这些需要握手连接的方式不在话题之内。

理论上，可以在服务器A的可用端口上建立http代理（connect方式处理443），在客户端配置全局网关，但是ISP封锁了这些流量，换言之，以8000端口方式，浏览器可以直接访问设在服务器A上的网页代理，但是以代理服务器的方式通过8000端口，则服务器端探测不到任何访问。而上文中的各种握手连接，能到达服务器，只是在连接建立之前被重置。

所以，在不是清楚了解v2ray的outbound http协议的情况下，想来做个最后尝试。 下面是模板填写部分：

1. 你正在使用哪个版本的 V2Ray？（如果服务器和客户端使用了不同版本，请注明）
服务器： 4.23.3
客户端：4.23.1

2. 你的使用场景是什么？比如使用 Chrome 通过 Socks/VMess 代理观看 YouTube 视频。
前述

3. 你看到的不正常的现象是什么？（请描述具体现象，比如访问超时，TLS 证书错误等）
流量没有到达服务器端my.server.A.com，客户端报告 `v2ray.com/core/app/proxyman/outbound: failed to process outbound traffic > v2ray.com/core/proxy/http: connection ends >
context canceled`

`
2020/06/05 10:56:00 [Info] [93440755] v2ray.com/core/proxy/socks: TCP Connect request to tcp:52.10.174.113:443
2020/06/05 10:56:00 [Info] [93440755] v2ray.com/core/app/dispatcher: sniffed domain: incoming.telemetry.mozilla.org
2020/06/05 10:56:00 [Info] [93440755] v2ray.com/core/app/dispatcher: default route for tcp:incoming.telemetry.mozilla.org:443
2020/06/05 10:56:00 [Info] [93440755] v2ray.com/core/transport/internet/tcp: dialing TCP to tcp:my.server.A.com:8000
2020/06/05 10:56:00 tcp:127.0.0.1:52199 accepted tcp:52.10.174.113:443
2020/06/05 10:56:00 [Info] [2881118326] v2ray.com/core/proxy/socks: TCP Connect
request to tcp:13.249.71.11:443
2020/06/05 10:56:00 tcp:127.0.0.1:52200 accepted tcp:13.249.71.11:443
2020/06/05 10:56:00 [Info] [2881118326] v2ray.com/core/app/dispatcher: sniffed domain: firefox.settings.services.mozilla.com
2020/06/05 10:56:00 [Info] [2881118326] v2ray.com/core/app/dispatcher: default route for tcp:firefox.settings.services.mozilla.com:443
2020/06/05 10:56:00 [Info] [2881118326] v2ray.com/core/transport/internet/tcp: dialing TCP to tcp:my.server.A.com:8000
2020/06/05 10:56:01 [Info] [93440755] v2ray.com/core/app/proxyman/inbound: connection ends > v2ray.com/core/proxy/socks: connection ends > context canceled
2020/06/05 10:56:01 [Info] [2881118326] v2ray.com/core/app/proxyman/inbound: connection ends > v2ray.com/core/proxy/socks: connection ends > context canceled
2020/06/05 10:56:01 [Info] [93440755] v2ray.com/core/app/proxyman/outbound: failed to process outbound traffic > v2ray.com/core/proxy/http: connection ends > context canceled
2020/06/05 10:56:01 [Info] [2881118326] v2ray.com/core/app/proxyman/outbound: failed to process outbound traffic > v2ray.com/core/proxy/http: connection ends >
context canceled
2020/06/05 10:56:01 [Info] [4104748928] v2ray.com/core/proxy/socks: TCP Connect
request to tcp:52.10.174.113:443
2020/06/05 10:56:01 [Info] [4104748928] v2ray.com/core/app/dispatcher: sniffed domain: incoming.telemetry.mozilla.org
2020/06/05 10:56:01 [Info] [4104748928] v2ray.com/core/app/dispatcher: default route for tcp:incoming.telemetry.mozilla.org:443
2020/06/05 10:56:01 [Info] [4104748928] v2ray.com/core/transport/internet/tcp: dialing TCP to tcp:my.server.A.com:8000
2020/06/05 10:56:01 tcp:127.0.0.1:52203 accepted tcp:52.10.174.113:443
2020/06/05 10:56:01 tcp:127.0.0.1:52204 accepted tcp:13.249.71.11:443
2020/06/05 10:56:01 [Info] [3098529339] v2ray.com/core/proxy/socks: TCP Connect
request to tcp:13.249.71.11:443
2020/06/05 10:56:01 [Info] [3098529339] v2ray.com/core/app/dispatcher: sniffed domain: firefox.settings.services.mozilla.com
2020/06/05 10:56:01 [Info] [3098529339] v2ray.com/core/app/dispatcher: default route for tcp:firefox.settings.services.mozilla.com:443
2020/06/05 10:56:01 [Info] [3098529339] v2ray.com/core/transport/internet/tcp: dialing TCP to tcp:my.server.A.com:8000
2020/06/05 10:56:02 [Info] [4104748928] v2ray.com/core/app/proxyman/inbound: connection ends > v2ray.com/core/proxy/socks: connection ends > context canceled
2020/06/05 10:56:02 [Info] [4104748928] v2ray.com/core/app/proxyman/outbound: failed to process outbound traffic > v2ray.com/core/proxy/http: connection ends >
context canceled
2020/06/05 10:56:02 [Info] [3098529339] v2ray.com/core/app/proxyman/outbound: failed to process outbound traffic > v2ray.com/core/proxy/http: connection ends >
context canceled
2020/06/05 10:56:02 [Info] [3098529339] v2ray.com/core/app/proxyman/inbound: connection ends > v2ray.com/core/proxy/socks: connection ends > context canceled
2020/06/05 10:56:02 [Info] [3308621341] v2ray.com/core/proxy/socks: TCP Connect
request to tcp:52.10.174.113:443
`
浏览器则显示：

`
Secure Connection Failed

An error occurred during a connection to www.youtube.com. PR_END_OF_FILE_ERROR

    The page you are trying to view cannot be shown because the authenticity of the received data could not be verified.
    Please contact the website owners to inform them of this problem.
`
4. 你期待看到的正确表现是怎样的？
正常连接

5. 请附上你的配置（提交 Issue 前请隐藏服务器端IP地址）

服务器配置：
```javascript
{
    "log": {
        "loglevel": "debug"
    },
    "inbounds": [
        {
            "port": 8000, // 监听端口
            "protocol": "http",
            "settings": {
                "timeout:":0,
                "accounts":[
                    {
                        "user":"my_username",
                        "pass":"my_password"
                    }
                ],
                "allowTransparent":false,
                "userLevel":0
            }
        }
    ],
    "outbounds": [
        {
            "protocol": "freedom",
            "settings": {}
        }
    ]

}

```

客户端配置：
```javascript
{
    "log": {
        "loglevel": "debug"                                                                                                                                                    
    },

    "inbounds": [
        {
            "port": 10808, // 监听端口
            "protocol": "socks", // 入口协议为 SOCKS 5
            "sniffing": {
                "enabled": true,
                "destOverride": ["http", "tls"]
            },
            "settings": {
                "auth": "noauth"  // 不认证
            }
        }
    ],
    "outbounds": [
        {
            "protocol": "http",
            "settings": {
                "servers": [
                    {
                        "address": "my.server.A.com",//服务器IP
                        "port": 8000,//服务器端口
                        "users": [
                            {
                                "Username": "my_username",
                                "Password": "my_password"
                            }
                        ]
                    }
                ]
            },
            "streamSettings": {
                "security": "none", //如果是HTTPS代理,需要將none改為tls
                "tlsSettings": {
                    "allowInsecure": false
                }
            }
        }
    ]
}

```
想要澄清的问题：

1. 用outbound http协议能避免客户与服务器tls握手吗？（对我的场景而言，私密性不是问题）

2. 我的设置是参考了 [https://guide.v2fly.org/basics/http.html#%E9%85%8D%E7%BD%AE](url)， 而原本里，客户端的outbounds server是设为一个内网IP 192.168.108.1，我改成了我的外网服务器，这是问题所在吗？

最后，一小段tcpdump的样本，我不大懂解读，但是也许大神们能读出有用信息，当中1.1.1.1是客户，2.2.2.2是服务器A。注意这个不是上面的http配置是截获，而是基本的vmess方式下截获的。用上面的http配置的话，服务器端不会接收到任何流量。
`
17:32:06.813907 IP 1.1.1.1.39245 > 2.2.2.2.8000: Flags [S], seq 316355498, win 65535, options [mss 1400,sackOK,TS val 337464223 ecr 0,nop,wscale 8], length 0
17:32:06.813968 IP 2.2.2.2.8000 > 1.1.1.1.39245: Flags [S.], seq 533329137, ack 316355499, win 29200, options [mss 1460,nop,nop,sackOK,nop,wscale 7], length 0
17:32:06.885626 IP 1.1.1.1.39245 > 2.2.2.2.8000: Flags [.], ack 1, win 329, length 0
17:32:07.077714 IP 1.1.1.1.47480 > 2.2.2.2.8000: Flags [S], seq 2707922451, win 65535, options [mss 1400,sackOK,TS val 337464263 ecr 0,nop,wscale 8], length 0
17:32:07.077781 IP 2.2.2.2.8000 > 1.1.1.1.47480: Flags [S.], seq 374493428, ack 2707922452, win 29200, options [mss 1460,nop,nop,sackOK,nop,wscale 7], length 0
17:32:07.099755 IP 1.1.1.1.56865 > 2.2.2.2.8000: Flags [S], seq 3374146289, win 65535, options [mss 1400,sackOK,TS val 337464265 ecr 0,nop,wscale 8], length 0
17:32:07.099825 IP 2.2.2.2.8000 > 1.1.1.1.56865: Flags [S.], seq 4189933743, ack 3374146290, win 29200, options [mss 1460,nop,nop,sackOK,nop,wscale 7], length 0
17:32:07.105086 IP 1.1.1.1.23470 > 2.2.2.2.8000: Flags [S], seq 1688947863, win 65535, options [mss 1400,sackOK,TS val 337464265 ecr 0,nop,wscale 8], length 0
17:32:07.105170 IP 2.2.2.2.8000 > 1.1.1.1.23470: Flags [S.], seq 581669, ack 1688947864, win 29200, options [mss 1460,nop,nop,sackOK,nop,wscale 7], length 0
17:32:07.125237 IP 1.1.1.1.47480 > 2.2.2.2.8000: Flags [.], ack 1, win 329, length 0
17:32:07.134807 IP 1.1.1.1.61605 > 2.2.2.2.8000: Flags [S], seq 714371512, win 65535, options [mss 1400,sackOK,TS val 337464268 ecr 0,nop,wscale 8], length 0
17:32:07.134859 IP 2.2.2.2.8000 > 1.1.1.1.61605: Flags [S.], seq 675050309, ack 714371513, win 29200, options [mss 1460,nop,nop,sackOK,nop,wscale 7], length 0
17:32:07.135021 IP 1.1.1.1.56865 > 2.2.2.2.8000: Flags [.], ack 1, win 329, length 0
17:32:07.145340 IP 1.1.1.1.23470 > 2.2.2.2.8000: Flags [.], ack 1, win 329, length 0
17:32:07.171394 IP 1.1.1.1.61605 > 2.2.2.2.8000: Flags [.], ack 1, win 329, length 0
17:32:07.209178 IP 1.1.1.1.52675 > 2.2.2.2.8000: Flags [FP.], seq 1793842496:1793842587, ack 2065706561, win 329, length 91
17:32:07.209254 IP 2.2.2.2.8000 > 1.1.1.1.52675: Flags [R], seq 2065706561, win 0, length 0
17:32:08.110335 IP 1.1.1.1.48358 > 2.2.2.2.8000: Flags [S], seq 2535939299, win 65535, options [mss 1400,sackOK,TS val 337464366 ecr 0,nop,wscale 8], length 0
17:32:08.110409 IP 2.2.2.2.8000 > 1.1.1.1.48358: Flags [S.], seq 2243274167, ack 2535939300, win 29200, options [mss 1460,nop,nop,sackOK,nop,wscale 7], length 0
17:32:08.187528 IP 1.1.1.1.34145 > 2.2.2.2.8000: Flags [S], seq 1651779243, win 65535, options [mss 1400,sackOK,TS val 337464369 ecr 0,nop,wscale 8], length 0
17:32:08.187584 IP 2.2.2.2.8000 > 1.1.1.1.34145: Flags [S.], seq 2329484956, ack 1651779244, win 29200, options [mss 1460,nop,nop,sackOK,nop,wscale 7], length 0
17:32:08.188007 IP 1.1.1.1.48358 > 2.2.2.2.8000: Flags [.], ack 1, win 329, length 0
17:32:08.239385 IP 1.1.1.1.34145 > 2.2.2.2.8000: Flags [.], ack 1, win 329, length 0
17:32:08.697105 IP 1.1.1.1.40624 > 2.2.2.2.8000: Flags [FP.], seq 3428031883:3428032096, ack 3479631946, win 329, length 213
17:32:08.697151 IP 2.2.2.2.8000 > 1.1.1.1.40624: Flags [R], seq 3479631946, win 0, length 0
17:32:10.184455 IP 1.1.1.1.43484 > 2.2.2.2.8000: Flags [S], seq 1888679951, win 65535, options [mss 1400,sackOK,TS val 337464568 ecr 0,nop,wscale 8], length 0
17:32:10.184533 IP 2.2.2.2.8000 > 1.1.1.1.43484: Flags [S.], seq 3547784769, ack 1888679952, win 29200, options [mss 1460,nop,nop,sackOK,nop,wscale 7], length 0
17:32:10.188089 IP 1.1.1.1.56227 > 2.2.2.2.8000: Flags [S], seq 511223122, win 65535, options [mss 1400,sackOK,TS val 337464571 ecr 0,nop,wscale 8], length 0
17:32:10.188140 IP 2.2.2.2.8000 > 1.1.1.1.56227: Flags [S.], seq 1560994841, ack 511223123, win 29200, options [mss 1460,nop,nop,sackOK,nop,wscale 7], length 0
17:32:10.220419 IP 1.1.1.1.43484 > 2.2.2.2.8000: Flags [.], ack 1, win 329, length 0
17:32:10.224974 IP 1.1.1.1.56227 > 2.2.2.2.8000: Flags [.], ack 1, win 329, length 0
17:32:10.359672 IP 1.1.1.1.59908 > 2.2.2.2.8000: Flags [S], seq 2862535953, win 65535, options [mss 1400,sackOK,TS val 337464591 ecr 0,nop,wscale 8], length 0
17:32:10.359731 IP 2.2.2.2.8000 > 1.1.1.1.59908: Flags [S.], seq 2023269827, ack 2862535954, win 29200, options [mss 1460,nop,nop,sackOK,nop,wscale 7], length 0
17:32:10.401922 IP 1.1.1.1.59908 > 2.2.2.2.8000: Flags [.], ack 1, win 329, length 0
17:32:10.703222 IP 1.1.1.1.39245 > 2.2.2.2.8000: Flags [FP.], seq 186:295, ack 1, win 329, length 109
17:32:10.703256 IP 2.2.2.2.8000 > 1.1.1.1.39245: Flags [.], ack 1, win 237, options [nop,nop,sack 1 {186:296}], length 0
17:32:10.885930 IP 2.2.2.2.8000 > 1.1.1.1.39245: Flags [F.], seq 1, ack 1, win 237, options [nop,nop,sack 1 {186:296}], length 0
17:32:10.946064 IP 1.1.1.1.39245 > 2.2.2.2.8000: Flags [.], ack 2, win 329, length 0
17:32:11.091276 IP 1.1.1.1.47480 > 2.2.2.2.8000: Flags [FP.], seq 172:232, ack 1, win 329, length 60
17:32:11.091325 IP 2.2.2.2.8000 > 1.1.1.1.47480: Flags [.], ack 1, win 237, options [nop,nop,sack 1 {172:233}], length 0
17:32:11.123838 IP 1.1.1.1.23470 > 2.2.2.2.8000: Flags [FP.], seq 156:248, ack 1, win 329, length 92
17:32:11.123877 IP 2.2.2.2.8000 > 1.1.1.1.23470: Flags [.], ack 1, win 237, options [nop,nop,sack 1 {156:249}], length 0
17:32:11.125560 IP 2.2.2.2.8000 > 1.1.1.1.47480: Flags [F.], seq 1, ack 1, win 237, options [nop,nop,sack 1 {172:233}], length 0
17:32:11.135266 IP 2.2.2.2.8000 > 1.1.1.1.56865: Flags [F.], seq 1, ack 1, win 229, length 0
17:32:11.145619 IP 2.2.2.2.8000 > 1.1.1.1.23470: Flags [F.], seq 1, ack 1, win 237, options [nop,nop,sack 1 {156:249}], length 0
17:32:11.171697 IP 2.2.2.2.8000 > 1.1.1.1.61605: Flags [F.], seq 1, ack 1, win 229, length 0
17:32:11.193629 IP 1.1.1.1.56865 > 2.2.2.2.8000: Flags [FP.], seq 1:146, ack 1, win 329, length 145
17:32:11.193676 IP 2.2.2.2.8000 > 1.1.1.1.56865: Flags [R], seq 4189933744, win 0, length 0
17:32:11.234143 IP 1.1.1.1.23470 > 2.2.2.2.8000: Flags [FP.], seq 1:248, ack 1, win 329, length 247
`

感谢！

**Comment by darhwa** [comment]
由于http tunnel是明文，里面的TLS握手包防火墙一样看得见

**Comment by eN-Joy** [comment]
> 由于http tunnel是明文，里面的TLS握手包防火墙一样看得见

这个解释逻辑上还有可疑点：我用其他握手方式（vmess, openvpn, shadowsocks等）时，服务器端均能记录到客户端握手尝试，尽管最终连接会被ISP重置。但是我用原帖的配置时，服务器端完全看不到客户端发来的包。
另外，我在服务器特定端口上建的web proxy，客户可以用http协议完全访问，我设了一个portal网站，包括youtube, gmail都可以访问。这也让我怀疑http流量是没有tls握手的。
